SentenceID,Season,Episode,Sentence
233,1,Rixty_Minutes,"Morty: Yeah, ""Ball Fondlers,"""
234,1,Rixty_Minutes,"[ Metal music playing ]
Aah!"
235,1,Rixty_Minutes,"Hamster Reporter: Ha ha, hamster in Butt world weather is done, and now it's sports time coming up,
Oh, hello, there,
Good day to you, miss,"
236,1,Rixty_Minutes,"Beth: So, the hamster live inside the rectums of those people?"
237,1,Rixty_Minutes,"Rick: Yes, sweetie,
That's where the live,"
238,1,Rixty_Minutes,"Jerry: Well, how does that work? I mean, do the butts look like little apartments inside?"
239,1,Rixty_Minutes,"Morty: Yeah, and can they leave the butt and, like,
walk around on their own?"
240,1,Rixty_Minutes,"Rick: Look, I don't know,
I'm watching the same thing you guys are,"
241,1,Rixty_Minutes,"Summer: Grandpa Rick, if they leave the butt and the person wanders off, how would they find their butt person again?"
242,1,Rixty_Minutes,"Rick: I don't know, Summer,
I can't even hear the TV,
All right, that's it,
We're just gonna go there so you idiots can ask your stupid questions all day,"
243,1,Rixty_Minutes,"Jerry: Ooh, family vacation!"
244,1,Rixty_Minutes,
