Sentence_id,Season,Episode,Episode_num,Episode_id,Character,Line,Line_no_stopwords
5233,5233,2,Big_Trouble_in_Little_Sanchez,7,18,Rick:,"I BOOKED YOU FOR A TWO-DAY INTENSIVE AT NUPTIA FOUR, THE GALAXY'S MOST SUCCESSFUL COUPLES' COUNSELING INSTITUTE, THEY COULD SAVE THE MARRIAGE OF A DOG AND A BAR OF DARK CHOCOLATE, THEY COULD SAVE THE MARRIAGE OF A PORN STAR AND A PORN STAR,",booked two-day intensive nuptia four galaxy successful couples counseling institute could save marriage dog bar dark chocolate could save marriage porn star porn star
5241,5241,2,Big_Trouble_in_Little_Sanchez,7,18,Rick:,"OKAY, HAVE FUN, SEE YA THURSDAY!",okay fun see ya thursday
5263,5263,2,Big_Trouble_in_Little_Sanchez,7,18,Tiny Rick:,"WHAT UP, MY HELSINGS? WHO WANTS TO HUNT A VAMPIRE? HA HA HA! Morty: RICK? HOW -- HOW DID YOU --",helsings wants hunt vampire ha ha ha morty rick
5264,5264,2,Big_Trouble_in_Little_Sanchez,7,18,Tiny Rick:,"YEAH, I GOT BORED AND THEN, I REMEMBERED, THIS MORNING, HOW I BLEW SUMMER OFF, AND I THOUGHT, ""HEY, WHY ARE YOU SUCH A GRUMPY DOUCHE, RICK? GO TO THE GARAGE, TRANSFER YOUR MIND INTO A YOUNGER CLONE OF YOURSELF, AND GET EMBROILED IN SOME YOUTHFUL HIJINKS, WHAT'S THE BFD?"" SO HERE I AM, I'M TINY RICK!",yeah got bored remembered morning blew summer thought `` hey grumpy douche rick go garage transfer mind younger clone get embroiled youthful hijinks bfd tiny rick
5267,5267,2,Big_Trouble_in_Little_Sanchez,7,18,Tiny Rick:,"DON'T SHORT-SELL YOURSELF, SUMMER, YOU GOT EVERYTHING IT TAKES, BUT IT'LL STILL BE FUN TO DO THIS AS A bleep TEAM, MOTHERbleep TINY RICK!",short-sell summer got everything takes still fun bleep team motherbleep tiny rick
5269,5269,2,Big_Trouble_in_Little_Sanchez,7,18,Tiny Rick:,"HEY, TOBY, I'M TINY RICK, I'M NEW, HEY OH -- GO EASY ON ME, HA HA, JUST KIDDIN',",hey toby tiny rick new hey oh go easy ha ha kiddin
5272,5272,2,Big_Trouble_in_Little_Sanchez,7,18,Tiny Rick:,"WHY WOULDN'T HE? YOU'RE GREAT! BUT, LISTEN, JUST BE CAREFUL, WE CAN'T RULE ANYBODY OUT AS THE VAMPIRE, NOT EVEN THE DREAMBOATS,",would great listen careful ca rule anybody vampire even dreamboats
5274,5274,2,Big_Trouble_in_Little_Sanchez,7,18,Tiny Rick:,HUNTIN' A VAMPIRE WITH MY GRANDKIDS! bleep! TINY RI-I-CK!,huntin vampire grandkids bleep tiny ri-i-ck
5278,5278,2,Big_Trouble_in_Little_Sanchez,7,18,Tiny Rick:,"YOU DID GREAT, GUYS, COULDN'T HAVE DONE IT WITHOUT YA, YOU KNOW, WE -- W-WE SHOULD BE PROUD OF OURSELVES, WE KILLED A VAMPIRE AND A GYM TEACHER, HA HA HA, TALK ABOUT TWO-FOR-ONE, RIGHT?!",great guys could done without ya know w-we proud killed vampire gym teacher ha ha ha talk two-for-one right
5280,5280,2,Big_Trouble_in_Little_Sanchez,7,18,Tiny Rick:,"OH, YOU KNOW, HYPERBARIC QUANTUM FLUID, buurp THAT KIND OF THING, IT PRESERVES LIVING TISSUE, NOT THAT THERE WAS MUCH TO PRESERVE, LOOK AT THAT MUMMY! HA! HA HA! AND I GUESS IT'S TIME FOR ME TO GET BACK INSIDE THE OLD-TIMER,",oh know hyperbaric quantum fluid buurp kind thing preserves living tissue much preserve look mummy ha ha ha guess time get back inside old-timer
5282,5282,2,Big_Trouble_in_Little_Sanchez,7,18,Tiny Rick:,"ALL RIGHT, WAY TO GO, SUMMER! WHAT DID I TELL YOU?",right way go summer tell
5284,5284,2,Big_Trouble_in_Little_Sanchez,7,18,Tiny Rick:,"WELL, YOU KNOW WHAT, SUMMER? TELL HIM TINY RICK WILL BE HERE! AND TELL HIM TO BRING SOME BREWS!",well know summer tell tiny rick tell bring brews
5286,5286,2,Big_Trouble_in_Little_Sanchez,7,18,Tiny Rick:,"HELL, YEAH! WHAT'S ONE MORE NIGHT? AND WHO CAN HAVE FUN WITH THIS OLD BASTARD HANGING AROUND, HUH?   WUBBY LUBBY DOOB DOOB! WHOO! -TINY RICK!",hell yeah one night fun old bastard hanging around huh wubby lubby doob doob whoo -tiny rick
5299,5299,2,Big_Trouble_in_Little_Sanchez,7,18,Tiny Rick:,"ALL RIGHT, EVERYBODY, THIS NEXT ONE'S COMING STRAIGHT FROM THE HEART, MAKING THE LYRICS UP RIGHT OFF THE TOP OF MY HEAD,  LET ME OUT  WHAT YOU SEE IS NOT THE SAME PERSON AS ME   MY LIFE'S A LIE  I'M NOT WHO YOU'RE LOOKING AT   LET ME OUT, SET ME FREE  I'M REALLY OLD; THIS ISN'T ME   MY REAL BODY'S SLOWLY DYIN' IN A VAT   IS ANYBODY LISTENING'  CAN ANYONE UNDERSTAND?  STOP LOOKIN' AT ME LIKE THAT AND ACTUALLY HELP ME   HELP ME!  HELP ME; I'M GONNA DIE! TINY RICK! THANKS, EVERYBODY!",right everybody next one coming straight heart making lyrics right top head let see person life lie looking let set free really old real body slowly dyin vat anybody listening anyone understand stop lookin like actually help help help gonna die tiny rick thanks everybody
5333,5333,2,Big_Trouble_in_Little_Sanchez,7,18,Tiny Rick:,"ALL RIGHT! GOOD WORK, MR, GOLDENFOLD!",right good work mr goldenfold
5335,5335,2,Big_Trouble_in_Little_Sanchez,7,18,Tiny Rick:,"HEY, WHAT'S UP, SUMMER? OOH, NICE TOP,",hey summer ooh nice top
5337,5337,2,Big_Trouble_in_Little_Sanchez,7,18,Tiny Rick:,"NO CAN DO, TONIGHT'S THE BIG DANCE AND MORTY'S BRINGING JESSICA, HE NEEDS HIS TINY WING MAN, Both: TINY RICK!  ",tonight big dance morty bringing jessica needs tiny wing man tiny rick
5339,5339,2,Big_Trouble_in_Little_Sanchez,7,18,Tiny Rick:,"I DON'T KNOW, WHEN I FEEL LIKE IT?",know feel like
5341,5341,2,Big_Trouble_in_Little_Sanchez,7,18,Tiny Rick:,"YEAH, AND YOU KNOW WHAT? I LIKE HIGH SCHOOL, I LIKE HANGING OUT, TINY RICK!",yeah know like high school like hanging tiny rick
5346,5346,2,Big_Trouble_in_Little_Sanchez,7,18,Tiny Rick:,"I'VE GOT AN EMO STREAK, IT'S PART OF WHAT MAKES ME SO RAD,",got emo streak part makes rad
5348,5348,2,Big_Trouble_in_Little_Sanchez,7,18,Tiny Rick:,"COME ON, SUMMER, THAT'S THE TITLE OF THE ART, WHY WAS KNIGHT RIDER CALLED KNIGHT RIDER? THE CAR'S NAME WAS KITT, NOBODY RODE MICHAEL KNIGHT, YOU'RE OVERTHINKING IT, SUMMER, I'M TINY RICK!",come summer title art knight rider called knight rider car name kitt nobody rode michael knight overthinking summer tiny rick
5350,5350,2,Big_Trouble_in_Little_Sanchez,7,18,Tiny Rick:,"WELL, SUMMER, I HEAR TOBY MATTHEWS ISN'T INTO PSYCHO CHICKS, CAN'T THINK OF ANYONE THAT IS, I'LL SEE YOU MOTHERbleep AT THE DANCE! TINY RICK!",well summer hear toby matthews psycho chicks ca think anyone see motherbleep dance tiny rick
5367,5367,2,Big_Trouble_in_Little_Sanchez,7,18,Tiny Rick:,"OH, HEY H-HEY-Y! MORTY, JESSICA, WHAT'S UP? CHECK OUT THE NEW DANCE I MADE UP, IT'S CALLED ""OOH LET ME OUT!""  LET ME OUT  LET ME OUT  THIS IS NOT A DANCE  I'M BEGGIN' FOR HELP  I'M SCREAMIN' FOR HELP  PLEASE COME LET ME OUT  LET ME OUT  LET ME OUT  THIS IS NOT A DANCE  I'M BEGGIN' FOR HELP  I'M SCREAMIN' FOR HELP  PLEASE COME LET ME OUT  I'M DYIN' IN A VAT  IN THE GARA-A-GE ",oh hey h-hey-y morty jessica check new dance made called `` ooh let let let dance beggin help screamin help please come let let let dance beggin help screamin help please come let dyin vat gara-a-ge
5372,5372,2,Big_Trouble_in_Little_Sanchez,7,18,Tiny Rick:,"I JUST GOT EXPELLED, SUMMER!",got expelled summer
5374,5374,2,Big_Trouble_in_Little_Sanchez,7,18,Tiny Rick:,SCREW YOUR TOP! YOU RATTED ON ME?! I'M TINY RICK!,screw top ratted tiny rick
5376,5376,2,Big_Trouble_in_Little_Sanchez,7,18,Tiny Rick:,HIGH SCHOOL IS MY LIFE! SUMMER SMITH IS A bleep PSYCHO NERD AND SHE JUST GOT ME KICKED OUT OF SCHOOL!,high school life summer smith bleep psycho nerd got kicked school
5390,5390,2,Big_Trouble_in_Little_Sanchez,7,18,Tiny Rick:,"SAY GOODNIGHT, OLD MAN,",say goodnight old man
5392,5392,2,Big_Trouble_in_Little_Sanchez,7,18,Tiny Rick:,WHAT THE HELL ARE YOU DOING?!,hell
5394,5394,2,Big_Trouble_in_Little_Sanchez,7,18,Tiny Rick:,"SUMMER, YOU BITCH!",summer bitch
5396,5396,2,Big_Trouble_in_Little_Sanchez,7,18,Tiny Rick:,I DON'T NEED A GRANDDAUGHTER! I'M TINY RI-I-CK!,need granddaughter tiny ri-i-ck
5398,5398,2,Big_Trouble_in_Little_Sanchez,7,18,Tiny Rick:,"YOU THINK YOU'RE TOUGH, HUH, MORTY? WHAT ARE YOU GONNA DO? I'M TINY RICK, I'M THE COOLEST KID IN YOUR SCHOOL, HOW ARE YOU GONNA JUST MAKE ME DO WHATEVER YOU SAY, HUH?",think tough huh morty gonna tiny rick coolest kid school gonna make whatever say huh
5403,5403,2,Big_Trouble_in_Little_Sanchez,7,18,Tiny Rick:,UGH! NO!,ugh
5405,5405,2,Big_Trouble_in_Little_Sanchez,7,18,Tiny Rick:,UGH! NOOOOOOOO! GOD!,ugh noooooooo god
5407,5407,2,Big_Trouble_in_Little_Sanchez,7,18,Tiny Rick:,"OH, GOD, WHAT IS LIFE? HOW CAN SOMEONE SO TALENTED DIE SO YOUNG? WHAT IS BEING YOUNG? I'M NOT YOUNG, I'M OLD, I'M -- I'M GONNA DIE, MY BODY ISN'T REAL, MORTY! SUMMER! IT'S ME! IT'S RICK! REGULAR RICK! RICK! HOW DO WE GET YOU BACK INTO YOUR BODY? OKAY, LISTEN CAREFULLY, THERE'S A SET OF DIODES ON THE VAT'S CONTROL PANEL, A BLUE ONE AND A RED ONE, OH, GOD, WHAT KIND OF WORLD IS THIS? I DIDN'T ASK TO BE BORN, I NEED YOU TO CONNECT THE BLUE ONE TO MY LEFT TEMPLE AND THE RED ONE TO -- WHY DOESN'T ANYONE REALLY LIKE ME?",oh god life someone talented die young young young old gonna die body real morty summer rick regular rick rick get back body okay listen carefully set diodes vat control panel blue one red one oh god kind world ask born need connect blue one left temple red one anyone really like
5409,5409,2,Big_Trouble_in_Little_Sanchez,7,18,Tiny Rick:,JUST PUT THE STUPID WIRES ON MY HEAD! I HATE BEING A TEENAGER!,put stupid wires head hate teenager
5428,5428,2,Big_Trouble_in_Little_Sanchez,7,18,Rick:,"HOLY SHIT! THANKS, KIDS, YOU FIGURED IT OUT, WELL, SUMMER DID, KIND OF WEIRD THAT YOU WERE THAT WILLING TO SELL MY EXISTENCE OUT FOR SOME TRIM, MORTY,",holy shit thanks kids figured well summer kind weird willing sell existence trim morty
5431,5431,2,Big_Trouble_in_Little_Sanchez,7,18,Rick:,"BUT LISTEN -- I FORGIVE YOU BOTH BECAUSE YOU KNOW WHAT? I LEARNED, TODAY, SOMETHING IMPORTANT -- THE TEENAGE MIND IS ITS OWN WORST ENEMY, OH, I ALSO LEARNED THIS,,,   OPERATION PHOENIX IS NOT THE FALLBACK I THOUGHT IT WOULD BE, I GUESS IT'S BACK TO THE DRAWING BOARD,",listen forgive know learned today something important teenage mind worst enemy oh also learned operation phoenix fallback thought would guess back drawing board
5433,5433,2,Big_Trouble_in_Little_Sanchez,7,18,Rick:,"GRANDPA'S BACK, BABY! GRANDPA'S --",grandpa back baby grandpa
5434,5434,2,Big_Trouble_in_Little_Sanchez,7,18,Rick:,"OH, MAN, I GOTTA PICK UP YOUR PARENTS, THEY HAVE BEEN BLOWIN' ME UP, ONE LAST SWING FOR THE ROAD! AAAAAAAAAAAH!",oh man gotta pick parents blowin one last swing road aaaaaaaaaaah
5438,5438,2,Big_Trouble_in_Little_Sanchez,7,18,Rick:,"AHA, YOU SEE? WHAT DID I TELL YOU TWO? IT WORKED,",aha see tell two worked
5440,5440,2,Big_Trouble_in_Little_Sanchez,7,18,Rick:,"ALREADY LOST INTEREST, GET IN THE CAR, I'VE BEEN INSIDE A KID ALL DAY AND, NOW, I CAN FEEL MY BONES SCRAPING EACH OTHER, UH, JUST SO YOU'RE PREPARED, THERE'S A BUNCH OF DEAD MES IN THE GARAGE,",already lost interest get car inside kid day feel bones scraping uh prepared bunch dead mes garage
5442,5442,2,Big_Trouble_in_Little_Sanchez,7,18,Rick:,"NOT REALLY, JERRY, PROBABLY A COSMETIC CONNECTION YOUR MIND MISTAKES FOR THEMATIC,",really jerry probably cosmetic connection mind mistakes thematic
5444,5444,2,Big_Trouble_in_Little_Sanchez,7,18,Rick:,OLD RICK! RUININ' EVERYTHING!,old rick ruinin everything
5457,5457,2,Look_Who%27s_Purging_Now,9,20,Rick:,"I AGREE, MORTY, buurp IT'S NICE TO GET BACK TO THE BASICS AFTER A PRETTY INTENSE, MIXED-BAG OF A YEAR,",agree morty buurp nice get back basics pretty intense mixed-bag year
5459,5459,2,Look_Who%27s_Purging_Now,9,20,Rick:,"RELAX, THAT'S WHAT WINDSHIELDS ARE FOR,",relax windshields
5460,5460,2,Look_Who%27s_Purging_Now,9,20,Rick:,"I DIDN'T KNOW THAT THERE WERE BUGS OUT IN SPACE,",know bugs space
5463,5463,2,Look_Who%27s_Purging_Now,9,20,Rick:,"YEAH, GUESS I'M OUT OF FLUID, L-LET ME FIND A PLACE TO STOP, HEY, MUCHACHO, DOES YOUR PLANET HAVE WIPER FLUID YET, OR ARE YOU GONNA FREAK OUT AND START WORSHIPPING US?",yeah guess fluid l-let find place stop hey muchacho planet wiper fluid yet gonna freak start worshipping us
5465,5465,2,Look_Who%27s_Purging_Now,9,20,Rick:,"THANKS,",thanks
5467,5467,2,Look_Who%27s_Purging_Now,9,20,Rick:,"YEAH, SURE THING, WAIT A MINUTE, WHAT? WHY?",yeah sure thing wait minute
5471,5471,2,Look_Who%27s_Purging_Now,9,20,Rick:,"OH, I KNOW WHAT THIS IS! YOU'VE BEEN ABLE TO SUSTAIN WORLD PEACE BECAUSE YOU HAVE ONE NIGHT A YEAR WHERE YOU ALL RUN AROUND ROBBING AND MURDERING EACH OTHER WITHOUT CONSEQUENCE,",oh know able sustain world peace one night year run around robbing murdering without consequence
5474,5474,2,Look_Who%27s_Purging_Now,9,20,Rick:,"IT'S LIKE ""THE PURGE,"" MORTY, THAT MOVIE ""THE PURGE""?",like `` purge morty movie `` purge
5476,5476,2,Look_Who%27s_Purging_Now,9,20,Rick:,"NO, NO, BUT I'VE BEEN TO A FEW PLANETS WITH THE SAME GIMMICK, YOU KNOW, SOMETIMES IT'S CALLED THE CLEANSING OR THE RED TIME, THERE WAS THIS ONE WORLD THAT CALLED IT JUST MURDER NIGHT, I-IT'S A PURGE PLANET, THEY'RE PEACEFUL, AND THEN, YOU KNOW, THEY JUST PURGE,",planets gimmick know sometimes called cleansing red time one world called murder night i-it purge planet peaceful know purge
5478,5478,2,Look_Who%27s_Purging_Now,9,20,Rick:,"YEAH, YOU WANT TO CHECK IT OUT?",yeah want check
5480,5480,2,Look_Who%27s_Purging_Now,9,20,Rick:,"SO, WHAT DO YOU DO DURING THE FESTIVAL? YOU LOCK YOURSELF IN, OR YOU GO OUT AND DO SOME STUFF?",festival lock go stuff
5482,5482,2,Look_Who%27s_Purging_Now,9,20,Rick:,"OH, I BET YOU DO, OLD TIMER,  ",oh bet old timer
5484,5484,2,Look_Who%27s_Purging_Now,9,20,Rick:,"ALL RIGHT, WELL, W-WHAT DO I OWE YOU FOR THE WIPER FLUID?",right well w-what owe wiper fluid
5486,5486,2,Look_Who%27s_Purging_Now,9,20,Rick:,"OH, NO WAY, THAT'S REALLY NICE OF YOU,",oh way really nice
5488,5488,2,Look_Who%27s_Purging_Now,9,20,Rick:,"OHH, I DON'T DOUBT IT,",ohh doubt
5490,5490,2,Look_Who%27s_Purging_Now,9,20,Rick:,"YEAH, YEAH, HEY, HAVE A GOOD FESTIVAL, OLD TIMER,",yeah yeah hey good festival old timer
5493,5493,2,Look_Who%27s_Purging_Now,9,20,Rick:,"JUST A SECOND, MORTY, OH, LOOK AT THAT SUNSET,",second morty oh look sunset
5496,5496,2,Look_Who%27s_Purging_Now,9,20,Rick:,"THERE WE GO, MUCH BETTER, NOW WE CAN SEE,",go much better see
5498,5498,2,Look_Who%27s_Purging_Now,9,20,Rick:,"HEY, YOU KNOW WHAT, MORTY? WHY DON'T WE CHRISTEN OUR SQUEAKY-CLEAN WINDSHIELD HERE BY WATCHING A LITTLE OF THIS PURGE THROUGH IT?",hey know morty christen squeaky-clean windshield watching little purge
5500,5500,2,Look_Who%27s_Purging_Now,9,20,Rick:,"MORTY, GROW UP, IF YOU DON'T WANT TO WATCH, DON'T WATCH, BUT, YOU KNOW, IT'S MY CAR, buurp ALSO, IF YOU TELL YOUR MOM ABOUT THIS, -I'LL PURGE YOU,",morty grow want watch watch know car buurp also tell mom -i purge
5502,5502,2,Look_Who%27s_Purging_Now,9,20,Rick:,"SO, WHAT, Y-Y-YOU TRYING TO SIT HERE AND TELL ME THAT buurp I-IF -- IF THERE'S A VIDEO ONLINE WITH SOMEONE GETTING DECAPITATED, -YOU DON'T CLICK ON IT?",y-y-you trying sit tell buurp i-if video online someone getting decapitated -you click
5504,5504,2,Look_Who%27s_Purging_Now,9,20,Rick:,"I DON'T, BECAUSE IT WOULD BORE ME, I SEE bleep LIKE THAT FOR BREAKFAST, MORTY, BUT IF YOU DON'T DO IT, I SAY IT'S BECAUSE YOU'RE AFRAID OF YOUR OWN PRIMAL INSTINCTS, SO YOU STUFF THEM DOWN AND --",would bore see bleep like breakfast morty say afraid primal instincts stuff
5506,5506,2,Look_Who%27s_Purging_Now,9,20,Rick:,"OH, OH! Shh, Shh, IT'S STARTING, -OH-HO-HO! HERE WE GO,",oh oh shh shh starting -oh-ho-ho go
5508,5508,2,Look_Who%27s_Purging_Now,9,20,Rick:,"YEAH, YEAH, YEAH, YOUR MEDAL'S IN THE MAIL, -I'M GONNA GET A CLOSER LOOK, Morty: OH, OKAY, SURE, AND THEN SOMEONE'S GONNA THROW A ROCK AND HIT THE CAR AND THEN WE'RE GONNA CRASH AND WE'RE GONNA BE STUCK DOWN THERE AND IT'S GONNA BE WHAT WE DESERVE,",yeah yeah yeah medal mail -i gonna get closer look morty oh okay sure someone gonna throw rock hit car gonna crash gonna stuck gonna deserve
5509,5509,2,Look_Who%27s_Purging_Now,9,20,Rick:,"YAWN, WHOA!",yawn whoa
5511,5511,2,Look_Who%27s_Purging_Now,9,20,Rick:,"WHOA, THEY ARE PURGING THE bleep OUT OF EACH OTHER,",whoa purging bleep
5513,5513,2,Look_Who%27s_Purging_Now,9,20,Rick:,"OH, MY GOD! OH bleep THAT WAS -- OKAY, YEAH, T-THAT WAS GROSS, WOW, MAN, I THINK MY EYES WERE BIGGER THAN MY STOMACH ON THIS ONE, MORTY, UGH, MY APPETITE FOR PURGE-SPECTATING GOT FILLED PRETTY QUICK, OH, GOD,  ",oh god oh bleep okay yeah t-that gross wow man think eyes bigger stomach one morty ugh appetite purge-spectating got filled pretty quick oh god
5515,5515,2,Look_Who%27s_Purging_Now,9,20,Rick:,"ALL RIGHT, MORTY, L-LET'S GET OUT OF HERE,",right morty l-let get
5517,5517,2,Look_Who%27s_Purging_Now,9,20,Rick:,"buurp WHAT? WHY? THAT POOR GIRL, W-WE HAVE TO SAVE HER, UH, MORTY, IN SPACE, WE HAVE SOMETHING WE CALL THE NON-INTERFERENCE POLICY, WE GOT THE WIPER FLUID, WE WATCHED THEM KILL EACH OTHER, WE'RE LEAVING,",buurp poor girl w-we save uh morty space something call non-interference policy got wiper fluid watched kill leaving
5519,5519,2,Look_Who%27s_Purging_Now,9,20,Rick:,"YOU LITTLE TURD,",little turd
5524,5524,2,Look_Who%27s_Purging_Now,9,20,Rick:,"OH, MY GOD, THIS IS bleep AWESOME! MORTY, THIS IS REALLY COOL, HEY, Y-YOU WANT TO HELP ME OUT HERE AND KILL SOME PEOPLE? IT'S FUN, WE'RE TOTALLY JUSTIFIED BECAUSE WE'RE SAVING A LITTLE GIRL, I MEAN, W-W-WE'RE BOTH FREE AND CLEAR TO MURDER THESE PEOPLE,",oh god bleep awesome morty really cool hey y-you want help kill people fun totally justified saving little girl mean w-w-we free clear murder people
5527,5527,2,Look_Who%27s_Purging_Now,9,20,Rick:,YEAH?,yeah
5531,5531,2,Look_Who%27s_Purging_Now,9,20,Rick:,"OH, MORTY, HOW CAN I REFUSE AFTER ALL YOU'VE DONE TO BLACKMAIL ME?",oh morty refuse done blackmail
5534,5534,2,Look_Who%27s_Purging_Now,9,20,Rick:,"YES,",yes
5538,5538,2,Look_Who%27s_Purging_Now,9,20,Rick:,"GEEZ, YOU WORKING ON YOUR TIGHT FIVE FOR THE COMEDY STORE, MORTY?",geez working tight five comedy store morty
5555,5555,2,Look_Who%27s_Purging_Now,9,20,Rick:,HUH?,huh
5557,5557,2,Look_Who%27s_Purging_Now,9,20,Rick:,"YOU JUST NOW REMEMBERED YOUR NANA EXISTS,",remembered nana exists
5559,5559,2,Look_Who%27s_Purging_Now,9,20,Rick:,"HAVEN'T YOU BEEN THROUGH LIKE 15 PURGES? I MEAN, SOME AS A CHILD?",like 15 purges mean child
5561,5561,2,Look_Who%27s_Purging_Now,9,20,Rick:,"FINE, WHATEVER, MORTY, STAY, OH, GOD, OH, CRAP, OH, CRAP!",fine whatever morty stay oh god oh crap oh crap
5574,5574,2,Look_Who%27s_Purging_Now,9,20,Rick:,"MORTY! AAH! bleep AMISH BITCH SHOT ME!   SHE TRIED TO PURGE ME, MORTY, YOU LET YOUR WIENER DO THE WALKING, AND NOW I'M DEAD,",morty aah bleep amish bitch shot tried purge morty let wiener walking dead
5576,5576,2,Look_Who%27s_Purging_Now,9,20,Rick:,"YOU bleep KIDDING ME, MORTY?! SHE TOOK MY CAR AND THE GUN, WE'RE LIKE THE REST OF THESE ASSHOLES NOW, W-W-WE'RE GONNA GET PURGED, MORTY, HELP ME UP,",bleep kidding morty took car gun like rest assholes w-w-we gonna get purged morty help
5578,5578,2,Look_Who%27s_Purging_Now,9,20,Rick:,"IT'S IN THE CAR, DIP-ASS,   OH, GOD, IT HURTS, SHE GOT ME RIGHT IN THE GODDAMN LIVER, MORTY, IT'S THE HARDEST-WORKING LIVER IN THE GALAXY, MORTY, AND NOW IT HAS A HOLE IN IT, I HOPE IT WAS WORTH IT,",car dip-ass oh god hurts got right goddamn liver morty hardest-working liver galaxy morty hole hope worth
5580,5580,2,Look_Who%27s_Purging_Now,9,20,Rick:,"YEAH, WELL, THAT'S NOT REALLY THE THEME OF TONIGHT'S PARTY, HEADS UP, RAPISTS, WELL, DON'T JUST STAND THERE, MORTY, -PURGE 'EM,",yeah well really theme tonight party heads rapists well stand morty -purge
5582,5582,2,Look_Who%27s_Purging_Now,9,20,Rick:,"NO, ME, SHOULD I RUB MY LIVER HOLE ON THEM? PICK UP A STICK OR SOMETHING AND KILL THEM,",rub liver hole pick stick something kill
5585,5585,2,Look_Who%27s_Purging_Now,9,20,Rick:,"OH, MY GOD,  ",oh god
5586,5586,2,Look_Who%27s_Purging_Now,9,20,Rick:,"THERE'S MORE WHERE THAT CAME FROM! YOU WANT TO GET PURGED, YOU BRING IT! DROP buurp DROP YOUR SHIT! DROP IT ALL, MORTY, GO GET THEIR SHIT, HURRY UP, I ONLY HAD ONE OF THOSE THINGS I THREW, I'M HOLDING A BOX OF TIC TACS RIGHT NOW,",came want get purged bring drop buurp drop shit drop morty go get shit hurry one things threw holding box tic tacs right
5593,5593,2,Look_Who%27s_Purging_Now,9,20,Rick:,"HEY, SUMMER, IT'S GRANDPA, I NEED YOU TO DO ME A FAVOR,",hey summer grandpa need favor
5596,5596,2,Look_Who%27s_Purging_Now,9,20,Rick:,"Morty and I are on a planet that's purging, I need you to take down --",morty planet purging need take
5598,5598,2,Look_Who%27s_Purging_Now,9,20,Rick:,"WE'RE ON A PLANET THAT'S PURGING, SUMMER, PURGING, WE LOST OUR CAR AND MY GUN, AND WE'RE IN A PURGE,",planet purging summer purging lost car gun purge
5601,5601,2,Look_Who%27s_Purging_Now,9,20,Rick:,"Yes, I-I need you to take --",yes i-i need take
5603,5603,2,Look_Who%27s_Purging_Now,9,20,Rick:,"OH, MY GOD, HOLD ON,",oh god hold
5607,5607,2,Look_Who%27s_Purging_Now,9,20,Rick:,AAH!,aah
5610,5610,2,Look_Who%27s_Purging_Now,9,20,Rick:,"YES, JERRY, IT'S TADDI, A PERSON NO ONE'S EVER HEARD OF UNTIL NOW, CALLING YOU ON A SPACE PHONE,",yes jerry taddi person one ever heard calling space phone
5613,5613,2,Look_Who%27s_Purging_Now,9,20,Rick:,"RELOAD, FAST,",reload fast
5620,5620,2,Look_Who%27s_Purging_Now,9,20,Rick:,"ARE YOU WRITING THIS DOWN? WILL YOU PLEASE WRITE THIS DOWN? SUMMER: Yes, yes,",writing please write summer yes yes
5622,5622,2,Look_Who%27s_Purging_Now,9,20,Rick:,"YOU SON OF A BITCH! MORTY, I DON'T WANT TO BE THE ""A LITTLE HELP"" GUY, BUT A LITTLE HELP?",son bitch morty want `` little help guy little help
5625,5625,2,Look_Who%27s_Purging_Now,9,20,Rick:,"A SPOON, MORTY? A SPOON?!",spoon morty spoon
5627,5627,2,Look_Who%27s_Purging_Now,9,20,Rick:,"THERE'S A PILE OF SILVERWARE NEXT TO YOU, AND YOU THROW ME THE ONE THING THAT CAN NEVER KILL ANYTHING?",pile silverware next throw one thing never kill anything
5629,5629,2,Look_Who%27s_Purging_Now,9,20,Rick:,"Summer, on the shelf above my workbench in the garage, there's a red box with a keypad on it, You're gonna take that box outside, and you're gonna type the number I just gave you into the keypad, Got it?",summer shelf workbench garage red box keypad gonna take box outside gonna type number gave keypad got
5633,5633,2,Look_Who%27s_Purging_Now,9,20,Rick:,"MORTY, IF I CAN GET TO THE TOP OF THAT LIGHTHOUSE, I CAN SEND THE BEACON, AND YOUR SISTER CAN LAUNCH OUR PACKAGE, JUST REMEMBER, IF THERE'S PEOPLE IN THERE AND THEY TRY TO PURGE US, WE GOT TO PURGE THEM FIRST,",morty get top lighthouse send beacon sister launch package remember people try purge us got purge first
5635,5635,2,Look_Who%27s_Purging_Now,9,20,Rick:,"MORTY, IF WE'RE GONNA SURVIVE TONIGHT, YOU'RE GONNA NEED TO HARNESS YOUR REPRESSED RAGE,",morty gonna survive tonight gonna need harness repressed rage
5637,5637,2,Look_Who%27s_Purging_Now,9,20,Rick:,"SPOKEN LIKE A PERSON WITH REPRESSED RAGE,",spoken like person repressed rage
5640,5640,2,Look_Who%27s_Purging_Now,9,20,Rick:,"NO SUCH AGENDA, CHIEF,",agenda chief
5642,5642,2,Look_Who%27s_Purging_Now,9,20,Rick:,"BY THE WAY, LIFE ON OTHER PLANETS EXISTS, DON'T LET IT DISTRACT YOU,",way life planets exists let distract
5644,5644,2,Look_Who%27s_Purging_Now,9,20,Rick:,"OKAY,",okay
5658,5658,2,Look_Who%27s_Purging_Now,9,20,Rick:,"COME ON, SUMMER, HOW HARD IS IT TO TYPE SOME NUMBERS INTO A BOX?",come summer hard type numbers box
5660,5660,2,Look_Who%27s_Purging_Now,9,20,Rick:,"OH, THANK GOD, WELL, I DID MY JOB, SUMMER DID HER JOB, NOW ALL MORTY HAS TO DO IS FINISH LISTENING TO THAT TALE,",oh thank god well job summer job morty finish listening tale
5687,5687,2,Look_Who%27s_Purging_Now,9,20,Rick:,MORTY!,morty
5691,5691,2,Look_Who%27s_Purging_Now,9,20,Rick:,"WHOA! MORTY! WE'RE GUESTS HERE,",whoa morty guests
5695,5695,2,Look_Who%27s_Purging_Now,9,20,Rick:,"WHOA, MORTY, YOU JUST PURGED,",whoa morty purged
5697,5697,2,Look_Who%27s_Purging_Now,9,20,Rick:,"OKAY, TIME TO GO,",okay time go
5712,5712,2,Look_Who%27s_Purging_Now,9,20,Rick:,"IT'S OKAY, MORTY, IT'S THE PURGE, YOU KNOW? PUSHING OLD LIGHTHOUSE KEEPERS DOWN THE STAIRS IS TOTALLY COOL,",okay morty purge know pushing old lighthouse keepers stairs totally cool
5714,5714,2,Look_Who%27s_Purging_Now,9,20,Rick:,"WELL, YOU BETTER START GETTING USED TO IT, LITTLE BITCH, BECAUSE WE GOT SOME bleep COMPANY, HEY, THERE HE IS,",well better start getting used little bitch got bleep company hey
5717,5717,2,Look_Who%27s_Purging_Now,9,20,Rick:,"MORTY, TIME TO buurp PURGE,",morty time buurp purge
5719,5719,2,Look_Who%27s_Purging_Now,9,20,Rick:,"GEEZ, WOW, MORTY, NOW YOU'RE GETTING INTO IT, NEVER EXPECTED THAT OUT OF YOU, ALL RIGHT, UH, LET'S GO FIND MY SHIP, HEY, HEY, MORTY, MORTY, THERE IT IS DOWN THERE -- MY SHIP, IT LOOKS TO ME LIKE THE,,, MORTY?",geez wow morty getting never expected right uh let go find ship hey hey morty morty ship looks like morty
5724,5724,2,Look_Who%27s_Purging_Now,9,20,Rick:,"OOH, BOY, YOU'RE REALLY, UH,,,",ooh boy really uh
5727,5727,2,Look_Who%27s_Purging_Now,9,20,Rick:,"YOU'RE REALLY GOING FOR IT OVER THERE, HUH? I, UH buurp I THINK, UH buurp I THINK THOSE PEOPLE WERE JUST HIDING,",really going huh uh buurp think uh buurp think people hiding
5730,5730,2,Look_Who%27s_Purging_Now,9,20,Rick:,"OKAY, MORTY, NOW YOU'RE JUST SHOOTING CORPSES,",okay morty shooting corpses
5732,5732,2,Look_Who%27s_Purging_Now,9,20,Rick:,"OKAY, BUDDY, ALL RIGHT, THAT'S GOOD, GOOD JOB,",okay buddy right good good job
5734,5734,2,Look_Who%27s_Purging_Now,9,20,Rick:,"TIME TO GO HOME,",time go home
5737,5737,2,Look_Who%27s_Purging_Now,9,20,Rick:,W-W-WHAT DO YOU MEAN?,w-w-what mean
5740,5740,2,Look_Who%27s_Purging_Now,9,20,Rick:,"WHOA! GEEZ, MORTY, PURGE IT DOWN A LITTLE,",whoa geez morty purge little
5742,5742,2,Look_Who%27s_Purging_Now,9,20,Rick:,"MORTY buurp YOU'RE ACTING LIKE A buurp FREAKING LUNATIC, CALM DOWN,",morty buurp acting like buurp freaking lunatic calm
5744,5744,2,Look_Who%27s_Purging_Now,9,20,Rick:,"OKAY, S-SORRY ABOUT THAT, NOW, WHERE ARE THESE RICH PEOPLE?",okay s-sorry rich people
